{"schema_version":"2.0.0","acceptance_id":"ACC-C05-001","assessment_id":"ASM-DEMO-001","question_id":"Q-C05-001","mapping_id":"MAP-C05-001","evidence_id":"EVD-POLICY-001","lifecycle_id":"LCR-C05-002","decision":"ACCEPTED","decision_maker_type":"HUMAN","reviewer_id":"HUM-AUDITOR-001","decided_at":"2026-09-10T10:10:00Z","rationale":"The reviewed content directly supports this question."}
